"","GO.IDs","over_represented_pvalue","under_represented_pvalue","numDEInCat","numInCat","term","ontology","Cat","GO.Slim.Term","gene","uniprot","uniprot_taxa.id","uniprot.name"
"46","GO:0070885",0.00509891699167972,0.999774586849565,3,5,"negative regulation of calcineurin-NFAT signaling cascade","BP","P","signal transduction","PGEN_.00g002820; PGEN_.00g061400; PGEN_.00g114060","Q70KF4; O35115; Q5YJC2","CMYA5_MOUSE; FHL2_RAT; GSK3B_SPECI","Cardiomyopathy-associated protein 5 (Heart and skeletal muscle-specific and sprouty domain-containing) (Myospryn) (Stretch-response protein 553) (Stretch-responsive fibronectin protein type 3) (TRIM-like protein); Four and a half LIM domains protein 2 (FHL-2) (LIM domain protein DRAL) (Skeletal muscle LIM-protein 3) (SLIM-3); Glycogen synthase kinase-3 beta (GSK-3 beta) (EC 2.7.11.26) (Serine/threonine-protein kinase GSK3B) (EC 2.7.11.1)"
"47","GO:0016055",0.0336266046105868,0.983495034177043,15,93,"Wnt signaling pathway","BP","P","signal transduction","PGEN_.00g208580; PGEN_.00g043790; PGEN_.00g204470; PGEN_.00g190430; PGEN_.00g070040; PGEN_.00g316730; PGEN_.00g332130; PGEN_.00g191680; PGEN_.00g133410; PGEN_.00g004830; PGEN_.00g010610; PGEN_.00g004840; PGEN_.00g114060; PGEN_.00g291150; PGEN_.00g212560","Q3L254; P97346; P41221; O75096; Q9U943; O95271; A0JM23; Q5R4V3; Q503L9; Q8BRK8; O75581; P54646; Q5YJC2; P67868; Q6PFX9","WNT7B_CHICK; NXN_MOUSE; WNT5A_HUMAN; LRP4_HUMAN; APLP_LOCMI; TNKS1_HUMAN; NPHP3_XENTR; KC1G3_PONAB; NXN_DANRE; AAPK2_MOUSE; LRP6_HUMAN; AAPK2_HUMAN; GSK3B_SPECI; CSK2B_BOVIN; TNKS1_MOUSE","Protein Wnt-7b; Nucleoredoxin (EC 1.8.1.8) (Protein Red-1); Protein Wnt-5a; Low-density lipoprotein receptor-related protein 4 (LRP-4) (Multiple epidermal growth factor-like domains 7); Apolipophorins [Cleaved into: Apolipophorin-2 (Apolipophorin II) (apoLp-2); Apolipophorin-1 (Apolipophorin I) (apoLp-1)]; Poly [ADP-ribose] polymerase tankyrase-1 (EC 2.4.2.30) (ADP-ribosyltransferase diphtheria toxin-like 5) (ARTD5) (Poly [ADP-ribose] polymerase 5A) (Protein poly-ADP-ribosyltransferase tankyrase-1) (EC 2.4.2.-) (TNKS-1) (TRF1-interacting ankyrin-related ADP-ribose polymerase) (Tankyrase I) (Tankyrase-1) (TANK1); Nephrocystin-3; Casein kinase I isoform gamma-3 (CKI-gamma 3) (EC 2.7.11.1); Nucleoredoxin (EC 1.8.1.8); 5'-AMP-activated protein kinase catalytic subunit alpha-2 (AMPK subunit alpha-2) (EC 2.7.11.1) (Acetyl-CoA carboxylase kinase) (ACACA kinase) (EC 2.7.11.27) (Hydroxymethylglutaryl-CoA reductase kinase) (HMGCR kinase) (EC 2.7.11.31); Low-density lipoprotein receptor-related protein 6 (LRP-6); 5'-AMP-activated protein kinase catalytic subunit alpha-2 (AMPK subunit alpha-2) (EC 2.7.11.1) (Acetyl-CoA carboxylase kinase) (ACACA kinase) (EC 2.7.11.27) (Hydroxymethylglutaryl-CoA reductase kinase) (HMGCR kinase) (EC 2.7.11.31); Glycogen synthase kinase-3 beta (GSK-3 beta) (EC 2.7.11.26) (Serine/threonine-protein kinase GSK3B) (EC 2.7.11.1); Casein kinase II subunit beta (CK II beta) (Phosvitin); Poly [ADP-ribose] polymerase tankyrase-1 (EC 2.4.2.30) (ADP-ribosyltransferase diphtheria toxin-like 5) (ARTD5) (Protein poly-ADP-ribosyltransferase tankyrase-1) (EC 2.4.2.-) (TRF1-interacting ankyrin-related ADP-ribose polymerase 1) (Tankyrase I) (Tankyrase-1) (TANK1)"
"48","GO:0035024",0.0470276324050614,0.992965617298596,3,9,"negative regulation of Rho protein signal transduction","BP","P","signal transduction","PGEN_.00g087850; PGEN_.00g211830; PGEN_.00g163480","Q9ULI3; P16056; Q4FZU8","HEG1_HUMAN; MET_MOUSE; RIPR1_RAT","Protein HEG homolog 1; Hepatocyte growth factor receptor (HGF receptor) (EC 2.7.10.1) (HGF/SF receptor) (Proto-oncogene c-Met) (Scatter factor receptor) (SF receptor) (Tyrosine-protein kinase Met); Rho family-interacting cell polarization regulator 1"
"49","GO:0043518",0.0253534692711542,0.999143879844744,2,3,"negative regulation of DNA damage response, signal transduction by p53 class mediator","BP","P","stress response","PGEN_.00g052930; PGEN_.00g048200","O60341; Q96EB6","KDM1A_HUMAN; SIR1_HUMAN","Lysine-specific histone demethylase 1A (EC 1.-.-.-) (BRAF35-HDAC complex protein BHC110) (Flavin-containing amine oxidase domain-containing protein 2); NAD-dependent protein deacetylase sirtuin-1 (hSIRT1) (EC 2.3.1.286) (NAD-dependent protein deacylase sirtuin-1) (EC 2.3.1.-) (Regulatory protein SIR2 homolog 1) (SIR2-like protein 1) (hSIR2) [Cleaved into: SirtT1 75 kDa fragment (75SirT1)]"
"50","GO:0015813",0.00354174431826176,0.999905944463584,3,4,"L-glutamate transmembrane transport","BP","P","transport","PGEN_.00g104460; PGEN_.00g192440; PGEN_.00g006410","Q9UJS0; P31596; P43005","CMC2_HUMAN; EAA2_RAT; EAA3_HUMAN","Calcium-binding mitochondrial carrier protein Aralar2 (Citrin) (Mitochondrial aspartate glutamate carrier 2) (Solute carrier family 25 member 13); Excitatory amino acid transporter 2 (GLT-1) (Sodium-dependent glutamate/aspartate transporter 2) (GLUT-R) (Solute carrier family 1 member 2); Excitatory amino acid transporter 3 (Excitatory amino-acid carrier 1) (Neuronal and epithelial glutamate transporter) (Sodium-dependent glutamate/aspartate transporter 3) (Solute carrier family 1 member 1)"
"51","GO:0046879",0.0253275582645489,0.999145237833493,2,3,"hormone secretion","BP","P","transport","PGEN_.00g229320; PGEN_.00g229340","P98158; P98158","LRP2_RAT; LRP2_RAT","Low-density lipoprotein receptor-related protein 2 (LRP-2) (Glycoprotein 330) (gp330) (Megalin); Low-density lipoprotein receptor-related protein 2 (LRP-2) (Glycoprotein 330) (gp330) (Megalin)"
"52","GO:0006907",0.0299193262724863,0.998892433428643,2,3,"pinocytosis","BP","P","transport","PGEN_.00g085250; PGEN_.00g166830","Q3ZBM5; Q54F25","SNX5_BOVIN; CLN3_DICDI","Sorting nexin-5; Battenin (Protein CLN3 homolog)"
"53","GO:0070779",0.0459434894576832,0.996983384960745,2,4,"D-aspartate import across plasma membrane","BP","P","transport","PGEN_.00g192440; PGEN_.00g006410","P31596; P43005","EAA2_RAT; EAA3_HUMAN","Excitatory amino acid transporter 2 (GLT-1) (Sodium-dependent glutamate/aspartate transporter 2) (GLUT-R) (Solute carrier family 1 member 2); Excitatory amino acid transporter 3 (Excitatory amino-acid carrier 1) (Neuronal and epithelial glutamate transporter) (Sodium-dependent glutamate/aspartate transporter 3) (Solute carrier family 1 member 1)"
"54","GO:0006836",0.048656013039486,0.992619914391234,3,9,"neurotransmitter transport","BP","P","transport","PGEN_.00g332320; PGEN_.00g015190; PGEN_.00g192440","Q05084; Q6INC8; P31596","ICA69_HUMAN; VGLU1_XENLA; EAA2_RAT","Islet cell autoantigen 1 (69 kDa islet cell autoantigen) (ICA69) (Islet cell autoantigen p69) (ICAp69) (p69); Vesicular glutamate transporter 1 (VGluT1) (Solute carrier family 17 member 7); Excitatory amino acid transporter 2 (GLT-1) (Sodium-dependent glutamate/aspartate transporter 2) (GLUT-R) (Solute carrier family 1 member 2)"
"55","GO:0062028",0.0119946482813044,1,2,2,"regulation of stress granule assembly","BP",NA,NA,"PGEN_.00g004830; PGEN_.00g004840","Q8BRK8; P54646","AAPK2_MOUSE; AAPK2_HUMAN","5'-AMP-activated protein kinase catalytic subunit alpha-2 (AMPK subunit alpha-2) (EC 2.7.11.1) (Acetyl-CoA carboxylase kinase) (ACACA kinase) (EC 2.7.11.27) (Hydroxymethylglutaryl-CoA reductase kinase) (HMGCR kinase) (EC 2.7.11.31); 5'-AMP-activated protein kinase catalytic subunit alpha-2 (AMPK subunit alpha-2) (EC 2.7.11.1) (Acetyl-CoA carboxylase kinase) (ACACA kinase) (EC 2.7.11.27) (Hydroxymethylglutaryl-CoA reductase kinase) (HMGCR kinase) (EC 2.7.11.31)"
"56","GO:1904428",0.0119946482813044,1,2,2,"negative regulation of tubulin deacetylation","BP",NA,NA,"PGEN_.00g004830; PGEN_.00g004840","Q8BRK8; P54646","AAPK2_MOUSE; AAPK2_HUMAN","5'-AMP-activated protein kinase catalytic subunit alpha-2 (AMPK subunit alpha-2) (EC 2.7.11.1) (Acetyl-CoA carboxylase kinase) (ACACA kinase) (EC 2.7.11.27) (Hydroxymethylglutaryl-CoA reductase kinase) (HMGCR kinase) (EC 2.7.11.31); 5'-AMP-activated protein kinase catalytic subunit alpha-2 (AMPK subunit alpha-2) (EC 2.7.11.1) (Acetyl-CoA carboxylase kinase) (ACACA kinase) (EC 2.7.11.27) (Hydroxymethylglutaryl-CoA reductase kinase) (HMGCR kinase) (EC 2.7.11.31)"
"57","GO:0140077",0.0253275582645489,0.999145237833493,2,3,"positive regulation of lipoprotein transport","BP",NA,NA,"PGEN_.00g229320; PGEN_.00g229340","P98158; P98158","LRP2_RAT; LRP2_RAT","Low-density lipoprotein receptor-related protein 2 (LRP-2) (Glycoprotein 330) (gp330) (Megalin); Low-density lipoprotein receptor-related protein 2 (LRP-2) (Glycoprotein 330) (gp330) (Megalin)"
"58","GO:0140058",0.0353658345926556,0.995478453854976,3,8,"neuron projection arborization","BP",NA,NA,"PGEN_.00g299380; PGEN_.00g229320; PGEN_.00g229340","C0HL13; P98158; P98158","LRP2_PIG; LRP2_RAT; LRP2_RAT","Low-density lipoprotein receptor-related protein 2 (LRP-2) (Glycoprotein 330) (gp330) (Megalin); Low-density lipoprotein receptor-related protein 2 (LRP-2) (Glycoprotein 330) (gp330) (Megalin); Low-density lipoprotein receptor-related protein 2 (LRP-2) (Glycoprotein 330) (gp330) (Megalin)"
"59","GO:1904743",0.0408159764172548,0.997492811695206,2,4,"negative regulation of telomeric DNA binding","BP",NA,NA,"PGEN_.00g316730; PGEN_.00g212560","O95271; Q6PFX9","TNKS1_HUMAN; TNKS1_MOUSE","Poly [ADP-ribose] polymerase tankyrase-1 (EC 2.4.2.30) (ADP-ribosyltransferase diphtheria toxin-like 5) (ARTD5) (Poly [ADP-ribose] polymerase 5A) (Protein poly-ADP-ribosyltransferase tankyrase-1) (EC 2.4.2.-) (TNKS-1) (TRF1-interacting ankyrin-related ADP-ribose polymerase) (Tankyrase I) (Tankyrase-1) (TANK1); Poly [ADP-ribose] polymerase tankyrase-1 (EC 2.4.2.30) (ADP-ribosyltransferase diphtheria toxin-like 5) (ARTD5) (Protein poly-ADP-ribosyltransferase tankyrase-1) (EC 2.4.2.-) (TRF1-interacting ankyrin-related ADP-ribose polymerase 1) (Tankyrase I) (Tankyrase-1) (TANK1)"
"60","GO:0061642",0.0415296138973979,0.994334089591133,3,8,"chemoattraction of axon","BP",NA,NA,"PGEN_.00g023480; PGEN_.00g229320; PGEN_.00g229340","Q91ZX7; P98158; P98158","LRP1_MOUSE; LRP2_RAT; LRP2_RAT","Prolow-density lipoprotein receptor-related protein 1 (LRP-1) (Alpha-2-macroglobulin receptor) (A2MR) (CD antigen CD91) [Cleaved into: Low-density lipoprotein receptor-related protein 1 85 kDa subunit (LRP-85); Low-density lipoprotein receptor-related protein 1 515 kDa subunit (LRP-515); Low-density lipoprotein receptor-related protein 1 intracellular domain (LRPICD)]; Low-density lipoprotein receptor-related protein 2 (LRP-2) (Glycoprotein 330) (gp330) (Megalin); Low-density lipoprotein receptor-related protein 2 (LRP-2) (Glycoprotein 330) (gp330) (Megalin)"
"61","GO:0005947",0.0285195541270651,0.998972054164399,2,3,"mitochondrial alpha-ketoglutarate dehydrogenase complex","CC","C","mitochondrion","PGEN_.00g130200; PGEN_.00g019720","O55028; P12694","BCKD_MOUSE; ODBA_HUMAN","[3-methyl-2-oxobutanoate dehydrogenase [lipoamide]] kinase, mitochondrial (EC 2.7.11.4) (Branched-chain alpha-ketoacid dehydrogenase kinase) (BCKD-kinase) (BCKDHKIN); 2-oxoisovalerate dehydrogenase subunit alpha, mitochondrial (EC 1.2.4.4) (Branched-chain alpha-keto acid dehydrogenase E1 component alpha chain) (BCKDE1A) (BCKDH E1-alpha)"
"62","GO:0016607",0.0338067887610077,0.981152618283223,21,148,"nuclear speck","CC","C","nucleus","PGEN_.00g261080; PGEN_.00g036880; PGEN_.00g054210; PGEN_.00g111610; PGEN_.00g024380; PGEN_.00g013150; PGEN_.00g150430; PGEN_.00g009290; PGEN_.00g172450; PGEN_.00g036870; PGEN_.00g322160; PGEN_.00g004830; PGEN_.00g331860; PGEN_.00g070630; PGEN_.00g279860; PGEN_.00g063780; PGEN_.00g264510; PGEN_.00g047870; PGEN_.00g018000; PGEN_.00g004840; PGEN_.00g167600","O75400; Q68CJ6; Q4TVV3; Q91WR3; P49750; Q9BQ04; Q96L91; Q8CG46; Q7ZVA0; Q8CF89; O43447; Q8BRK8; Q5ZKA3; Q2TBS9; O70422; Q2KJC1; P83038; Q501J6; B2RY56; P54646; Q3T106","PR40A_HUMAN; SLIP_HUMAN; DDX46_DANRE; ASCC2_MOUSE; YLPM1_HUMAN; RBM4B_HUMAN; EP400_HUMAN; SMC5_MOUSE; SMU1_DANRE; TAB1_MOUSE; PPIH_HUMAN; AAPK2_MOUSE; CWC22_CHICK; SMU1_BOVIN; TF2H4_MOUSE; CDC5L_BOVIN; HDAC4_CHICK; DDX17_MOUSE; RBM25_MOUSE; AAPK2_HUMAN; SRSF7_BOVIN","Pre-mRNA-processing factor 40 homolog A (Fas ligand-associated factor 1) (Formin-binding protein 11) (Formin-binding protein 3) (Huntingtin yeast partner A) (Huntingtin-interacting protein 10) (HIP-10) (Huntingtin-interacting protein A) (Renal carcinoma antigen NY-REN-6); Nuclear GTPase SLIP-GC (EC 3.6.1.-) (Speckled-like pattern in the germinal center); Probable ATP-dependent RNA helicase DDX46 (EC 3.6.4.13) (DEAD box protein 46); Activating signal cointegrator 1 complex subunit 2 (ASC-1 complex subunit p100) (Trip4 complex subunit p100); YLP motif-containing protein 1 (Nuclear protein ZAP3) (ZAP113); RNA-binding protein 4B (RNA-binding motif protein 30) (RNA-binding motif protein 4B) (RNA-binding protein 30); E1A-binding protein p400 (EC 3.6.4.-) (CAG repeat protein 32) (Domino homolog) (hDomino) (Trinucleotide repeat-containing gene 12 protein) (p400 kDa SWI2/SNF2-related protein); Structural maintenance of chromosomes protein 5 (SMC protein 5) (SMC-5) (mSMC5) (Protein expressed in male leptotene and zygotene spermatocytes 453) (MLZ-453); WD40 repeat-containing protein SMU1 (Smu-1 suppressor of mec-8 and unc-52 protein homolog); TGF-beta-activated kinase 1 and MAP3K7-binding protein 1 (Mitogen-activated protein kinase kinase kinase 7-interacting protein 1) (TGF-beta-activated kinase 1-binding protein 1) (TAK1-binding protein 1); Peptidyl-prolyl cis-trans isomerase H (PPIase H) (EC 5.2.1.8) (Rotamase H) (Small nuclear ribonucleoprotein particle-specific cyclophilin H) (CypH) (U-snRNP-associated cyclophilin SnuCyp-20) (USA-CYP); 5'-AMP-activated protein kinase catalytic subunit alpha-2 (AMPK subunit alpha-2) (EC 2.7.11.1) (Acetyl-CoA carboxylase kinase) (ACACA kinase) (EC 2.7.11.27) (Hydroxymethylglutaryl-CoA reductase kinase) (HMGCR kinase) (EC 2.7.11.31); Pre-mRNA-splicing factor CWC22 homolog (Nucampholin homolog); WD40 repeat-containing protein SMU1 (Smu-1 suppressor of mec-8 and unc-52 protein homolog) [Cleaved into: WD40 repeat-containing protein SMU1, N-terminally processed]; General transcription factor IIH subunit 4 (Basic transcription factor 2 52 kDa subunit) (BTF2 p52) (General transcription factor IIH polypeptide 4) (TFIIH basal transcription factor complex p52 subunit); Cell division cycle 5-like protein (Cdc5-like protein); Histone deacetylase 4 (HD4) (EC 3.5.1.98); Probable ATP-dependent RNA helicase DDX17 (EC 3.6.4.13) (DEAD box protein 17); RNA-binding protein 25 (RNA-binding motif protein 25); 5'-AMP-activated protein kinase catalytic subunit alpha-2 (AMPK subunit alpha-2) (EC 2.7.11.1) (Acetyl-CoA carboxylase kinase) (ACACA kinase) (EC 2.7.11.27) (Hydroxymethylglutaryl-CoA reductase kinase) (HMGCR kinase) (EC 2.7.11.31); Serine/arginine-rich splicing factor 7 (Splicing factor, arginine/serine-rich 7)"
"63","GO:0019005",0.0373128126727108,0.988934314974317,6,29,"SCF ubiquitin ligase complex","CC","C","other cellular component","PGEN_.00g113990; PGEN_.00g136060; PGEN_.00g030400; PGEN_.00g164170; PGEN_.00g111150; PGEN_.00g273980","A1Z6E0; Q9C5D2; Q9VZF4; Q5ZKF5; Q9UJT9; Q0VD31","GUS_DROME; FBL4_ARATH; FBXW7_DROME; SKP1_CHICK; FBXL7_HUMAN; FBXL4_BOVIN","Protein gustavus; F-box/LRR-repeat protein 4 (AtFBL4); F-box/WD repeat-containing protein 7 (F-box and WD-40 domain-containing protein 7) (Protein archipelago); S-phase kinase-associated protein 1 (Cyclin-A/CDK2-associated protein p19) (S-phase kinase-associated protein 1A) (p19A) (p19skp1); F-box/LRR-repeat protein 7 (F-box and leucine-rich repeat protein 7) (F-box protein FBL6/FBL7); F-box/LRR-repeat protein 4 (F-box and leucine-rich repeat protein 4)"
"64","GO:0033263",0.0288547115926171,0.998953191095634,2,3,"CORVET complex","CC","C","other cytoplasmic organelle","PGEN_.00g332750; PGEN_.00g199100","Q0P5W1; Q91W86","VPS8_MOUSE; VPS11_MOUSE","Vacuolar protein sorting-associated protein 8 homolog; Vacuolar protein sorting-associated protein 11 homolog"
"65","GO:0031313",0.0448944609442865,0.997090474643412,2,4,"extrinsic component of endosome membrane","CC","C","other cytoplasmic organelle","PGEN_.00g243570; PGEN_.00g085250","Q5ZLL7; Q3ZBM5","WDR91_CHICK; SNX5_BOVIN","WD repeat-containing protein 91; Sorting nexin-5"
"66","GO:0030117",0.0330766898000167,0.998704856793712,2,3,"membrane coat","CC","C","other membranes","PGEN_.00g279500; PGEN_.00g162260","Q08DF4; P17427","DYN1_BOVIN; AP2A2_MOUSE","Dynamin-1 (EC 3.6.5.5); AP-2 complex subunit alpha-2 (100 kDa coated vesicle protein C) (Adaptor protein complex AP-2 subunit alpha-2) (Adaptor-related protein complex 2 subunit alpha-2) (Alpha-adaptin C) (Alpha2-adaptin) (Clathrin assembly protein complex 2 alpha-C large chain) (Plasma membrane adaptor HA2/AP2 adaptin alpha C subunit)"
"67","GO:1990718",0.0117983335029213,1,2,2,"axonemal central pair projection","CC",NA,NA,"PGEN_.00g190220; PGEN_.00g190230","Q4G0P3; Q80W93","HYDIN_HUMAN; HYDIN_MOUSE","Hydrocephalus-inducing protein homolog; Hydrocephalus-inducing protein (Protein Hy-3)"
"68","GO:0005092",0.0234947685963517,0.999239261416507,2,3,"GDP-dissociation inhibitor activity","MF","F","enzyme regulator activity","PGEN_.00g279210; PGEN_.00g180390","P81274; Q9QXG2","GPSM2_HUMAN; RAE1_MOUSE","G-protein-signaling modulator 2 (Mosaic protein LGN); Rab proteins geranylgeranyltransferase component A 1 (Choroideremia protein homolog) (Rab escort protein 1) (REP-1)"
"69","GO:0030020",0.0179152228913198,0.998349828324448,3,7,"extracellular matrix structural constituent conferring tensile strength","MF","F","extracellular structural activity","PGEN_.00g188760; PGEN_.00g303970; PGEN_.00g260940","A8TX70; Q99715; Q7SIB2","CO6A5_HUMAN; COCA1_HUMAN; CO4A1_BOVIN","Collagen alpha-5(VI) chain (Collagen alpha-1(XXIX) chain) (von Willebrand factor A domain-containing protein 4); Collagen alpha-1(XII) chain; Collagen alpha-1(IV) chain [Cleaved into: Arresten]"
"70","GO:0035174",0.0301185989020484,0.998880919853383,2,3,"histone serine kinase activity","MF","F","kinase activity","PGEN_.00g004830; PGEN_.00g004840","Q8BRK8; P54646","AAPK2_MOUSE; AAPK2_HUMAN","5'-AMP-activated protein kinase catalytic subunit alpha-2 (AMPK subunit alpha-2) (EC 2.7.11.1) (Acetyl-CoA carboxylase kinase) (ACACA kinase) (EC 2.7.11.27) (Hydroxymethylglutaryl-CoA reductase kinase) (HMGCR kinase) (EC 2.7.11.31); 5'-AMP-activated protein kinase catalytic subunit alpha-2 (AMPK subunit alpha-2) (EC 2.7.11.1) (Acetyl-CoA carboxylase kinase) (ACACA kinase) (EC 2.7.11.27) (Hydroxymethylglutaryl-CoA reductase kinase) (HMGCR kinase) (EC 2.7.11.31)"
"71","GO:0047322",0.0301185989020484,0.998880919853383,2,3,"[hydroxymethylglutaryl-CoA reductase (NADPH)] kinase activity","MF","F","kinase activity","PGEN_.00g004830; PGEN_.00g004840","Q8BRK8; P54646","AAPK2_MOUSE; AAPK2_HUMAN","5'-AMP-activated protein kinase catalytic subunit alpha-2 (AMPK subunit alpha-2) (EC 2.7.11.1) (Acetyl-CoA carboxylase kinase) (ACACA kinase) (EC 2.7.11.27) (Hydroxymethylglutaryl-CoA reductase kinase) (HMGCR kinase) (EC 2.7.11.31); 5'-AMP-activated protein kinase catalytic subunit alpha-2 (AMPK subunit alpha-2) (EC 2.7.11.1) (Acetyl-CoA carboxylase kinase) (ACACA kinase) (EC 2.7.11.27) (Hydroxymethylglutaryl-CoA reductase kinase) (HMGCR kinase) (EC 2.7.11.31)"
"72","GO:0050405",0.0301185989020484,0.998880919853383,2,3,"[acetyl-CoA carboxylase] kinase activity","MF","F","kinase activity","PGEN_.00g004830; PGEN_.00g004840","Q8BRK8; P54646","AAPK2_MOUSE; AAPK2_HUMAN","5'-AMP-activated protein kinase catalytic subunit alpha-2 (AMPK subunit alpha-2) (EC 2.7.11.1) (Acetyl-CoA carboxylase kinase) (ACACA kinase) (EC 2.7.11.27) (Hydroxymethylglutaryl-CoA reductase kinase) (HMGCR kinase) (EC 2.7.11.31); 5'-AMP-activated protein kinase catalytic subunit alpha-2 (AMPK subunit alpha-2) (EC 2.7.11.1) (Acetyl-CoA carboxylase kinase) (ACACA kinase) (EC 2.7.11.27) (Hydroxymethylglutaryl-CoA reductase kinase) (HMGCR kinase) (EC 2.7.11.31)"
"73","GO:0003918",0.00873979953540208,1,2,2,"DNA topoisomerase type II (double strand cut, ATP-hydrolyzing) activity","MF","F","nucleic acid binding activity","PGEN_.00g333150; PGEN_.00g001210","Q01320; Q9WTK8","TOP2A_MOUSE; SPO11_MOUSE","DNA topoisomerase 2-alpha (EC 5.6.2.2) (DNA topoisomerase II, alpha isozyme); Meiotic recombination protein SPO11 (EC 5.6.2.2)"
"74","GO:0050694",0.00621395999824772,0.999360961003548,4,10,"galactose 3-O-sulfotransferase activity","MF","F","other molecular function","PGEN_.00g129780; PGEN_.00g135120; PGEN_.00g134400; PGEN_.00g237520","P61315; P61315; P61315; P61315","G3ST3_MOUSE; G3ST3_MOUSE; G3ST3_MOUSE; G3ST3_MOUSE","Galactose-3-O-sulfotransferase 3 (Gal3ST-3) (EC 2.8.2.-) (Beta-galactose-3-O-sulfotransferase 3) (Gal-beta-1, 3-GalNAc 3'-sulfotransferase 3); Galactose-3-O-sulfotransferase 3 (Gal3ST-3) (EC 2.8.2.-) (Beta-galactose-3-O-sulfotransferase 3) (Gal-beta-1, 3-GalNAc 3'-sulfotransferase 3); Galactose-3-O-sulfotransferase 3 (Gal3ST-3) (EC 2.8.2.-) (Beta-galactose-3-O-sulfotransferase 3) (Gal-beta-1, 3-GalNAc 3'-sulfotransferase 3); Galactose-3-O-sulfotransferase 3 (Gal3ST-3) (EC 2.8.2.-) (Beta-galactose-3-O-sulfotransferase 3) (Gal-beta-1, 3-GalNAc 3'-sulfotransferase 3)"
"75","GO:0019904",0.00900587092197258,0.996275677619482,15,83,"protein domain specific binding","MF","F","other molecular function","PGEN_.00g204470; PGEN_.00g279210; PGEN_.00g332320; PGEN_.00g303120; PGEN_.00g199580; PGEN_.00g162260; PGEN_.00g123580; PGEN_.00g254610; PGEN_.00g185910; PGEN_.00g164170; PGEN_.00g047370; PGEN_.00g199100; PGEN_.00g167600; PGEN_.00g291150; PGEN_.00g102410","P41221; P81274; Q05084; P35601; P46935; P17427; Q9QZS7; Q925H1; Q9UN37; Q5ZKF5; Q01177; Q91W86; Q3T106; P67868; P53367","WNT5A_HUMAN; GPSM2_HUMAN; ICA69_HUMAN; RFC1_MOUSE; NEDD4_MOUSE; AP2A2_MOUSE; NPHN_MOUSE; TRPS1_MOUSE; VPS4A_HUMAN; SKP1_CHICK; PLMN_RAT; VPS11_MOUSE; SRSF7_BOVIN; CSK2B_BOVIN; ARFP1_HUMAN","Protein Wnt-5a; G-protein-signaling modulator 2 (Mosaic protein LGN); Islet cell autoantigen 1 (69 kDa islet cell autoantigen) (ICA69) (Islet cell autoantigen p69) (ICAp69) (p69); Replication factor C subunit 1 (A1-P145) (Activator 1 140 kDa subunit) (A1 140 kDa subunit) (Activator 1 large subunit) (Activator 1 subunit 1) (Differentiation-specific element-binding protein) (ISRE-binding protein) (Replication factor C 140 kDa subunit) (RF-C 140 kDa subunit) (RFC140) (Replication factor C large subunit); E3 ubiquitin-protein ligase NEDD4 (EC 2.3.2.26) (HECT-type E3 ubiquitin transferase NEDD4) (Neural precursor cell expressed developmentally down-regulated protein 4) (NEDD-4); AP-2 complex subunit alpha-2 (100 kDa coated vesicle protein C) (Adaptor protein complex AP-2 subunit alpha-2) (Adaptor-related protein complex 2 subunit alpha-2) (Alpha-adaptin C) (Alpha2-adaptin) (Clathrin assembly protein complex 2 alpha-C large chain) (Plasma membrane adaptor HA2/AP2 adaptin alpha C subunit); Nephrin (Renal glomerulus-specific cell adhesion receptor); Zinc finger transcription factor Trps1; Vacuolar protein sorting-associated protein 4A (EC 3.6.4.6) (Protein SKD2) (VPS4-1) (hVPS4); S-phase kinase-associated protein 1 (Cyclin-A/CDK2-associated protein p19) (S-phase kinase-associated protein 1A) (p19A) (p19skp1); Plasminogen (EC 3.4.21.7) [Cleaved into: Plasmin heavy chain A; Activation peptide; Angiostatin; Plasmin heavy chain A, short form; Plasmin light chain B]; Vacuolar protein sorting-associated protein 11 homolog; Serine/arginine-rich splicing factor 7 (Splicing factor, arginine/serine-rich 7); Casein kinase II subunit beta (CK II beta) (Phosvitin); Arfaptin-1 (ADP-ribosylation factor-interacting protein 1)"
"76","GO:0070064",0.00972076371977897,0.998858641466567,4,10,"proline-rich region binding","MF","F","other molecular function","PGEN_.00g261080; PGEN_.00g100690; PGEN_.00g199580; PGEN_.00g255960","O75400; Q5HYK7; P46935; Q8CGF7","PR40A_HUMAN; SH319_HUMAN; NEDD4_MOUSE; TCRG1_MOUSE","Pre-mRNA-processing factor 40 homolog A (Fas ligand-associated factor 1) (Formin-binding protein 11) (Formin-binding protein 3) (Huntingtin yeast partner A) (Huntingtin-interacting protein 10) (HIP-10) (Huntingtin-interacting protein A) (Renal carcinoma antigen NY-REN-6); SH3 domain-containing protein 19 (ADAM-binding protein Eve-1) (EEN-binding protein) (EBP); E3 ubiquitin-protein ligase NEDD4 (EC 2.3.2.26) (HECT-type E3 ubiquitin transferase NEDD4) (Neural precursor cell expressed developmentally down-regulated protein 4) (NEDD-4); Transcription elongation regulator 1 (Formin-binding protein 28) (FBP 28) (TATA box-binding protein-associated factor 2S) (Transcription factor CA150) (p144)"
"77","GO:0004029",0.0122901592731908,0.999108084924189,3,6,"aldehyde dehydrogenase (NAD+) activity","MF","F","other molecular function","PGEN_.00g202150; PGEN_.00g264440; PGEN_.00g240840","P81178; Q9JLJ2; P11884","ALDH2_MESAU; AL9A1_MOUSE; ALDH2_RAT","Aldehyde dehydrogenase, mitochondrial (EC 1.2.1.3) (ALDH class 2) (ALDH-E2) (ALDH1); 4-trimethylaminobutyraldehyde dehydrogenase (TMABA-DH) (TMABADH) (EC 1.2.1.47) (Aldehyde dehydrogenase family 9 member A1) (EC 1.2.1.3); Aldehyde dehydrogenase, mitochondrial (EC 1.2.1.3) (ALDH class 2) (ALDH-E2) (ALDH1)"
"78","GO:0001733",0.0178313086979946,0.997254917319969,4,13,"galactosylceramide sulfotransferase activity","MF","F","other molecular function","PGEN_.00g129780; PGEN_.00g135120; PGEN_.00g134400; PGEN_.00g237520","P61315; P61315; P61315; P61315","G3ST3_MOUSE; G3ST3_MOUSE; G3ST3_MOUSE; G3ST3_MOUSE","Galactose-3-O-sulfotransferase 3 (Gal3ST-3) (EC 2.8.2.-) (Beta-galactose-3-O-sulfotransferase 3) (Gal-beta-1, 3-GalNAc 3'-sulfotransferase 3); Galactose-3-O-sulfotransferase 3 (Gal3ST-3) (EC 2.8.2.-) (Beta-galactose-3-O-sulfotransferase 3) (Gal-beta-1, 3-GalNAc 3'-sulfotransferase 3); Galactose-3-O-sulfotransferase 3 (Gal3ST-3) (EC 2.8.2.-) (Beta-galactose-3-O-sulfotransferase 3) (Gal-beta-1, 3-GalNAc 3'-sulfotransferase 3); Galactose-3-O-sulfotransferase 3 (Gal3ST-3) (EC 2.8.2.-) (Beta-galactose-3-O-sulfotransferase 3) (Gal-beta-1, 3-GalNAc 3'-sulfotransferase 3)"
